{
  "schemaVersion": "obiara.launch-gates.v1",
  "environment": "production",
  "market": "GH",
  "candidateSha": "1111111111111111111111111111111111111111",
  "generatedAt": "2026-07-27T08:00:00Z",
  "expiresAt": "2026-07-28T08:00:00Z",
  "evidence": [
    {"gateId":"repository.engineering","evidenceRef":"0000000000000000000000000000000000000000000000000000000000000001","kind":"repository","provenance":"repository-control","environment":"production","market":"GH","candidateSha":"1111111111111111111111111111111111111111","issuerRef":"role/engineering-ci","reviewerRef":"role/release-reviewer","outcome":"satisfied","synthetic":true,"collectedAt":"2026-07-27T07:00:00Z","expiresAt":"2026-07-28T07:00:00Z"},
    {"gateId":"repository.security","evidenceRef":"0000000000000000000000000000000000000000000000000000000000000002","kind":"repository","provenance":"repository-control","environment":"production","market":"GH","candidateSha":"1111111111111111111111111111111111111111","issuerRef":"role/security-ci","reviewerRef":"role/security-reviewer","outcome":"satisfied","synthetic":true,"collectedAt":"2026-07-27T07:00:00Z","expiresAt":"2026-07-28T07:00:00Z"},
    {"gateId":"repository.recovery","evidenceRef":"0000000000000000000000000000000000000000000000000000000000000003","kind":"repository","provenance":"repository-control","environment":"production","market":"GH","candidateSha":"1111111111111111111111111111111111111111","issuerRef":"role/data-platform","reviewerRef":"role/security-reviewer","outcome":"satisfied","synthetic":true,"collectedAt":"2026-07-27T07:00:00Z","expiresAt":"2026-07-28T07:00:00Z"},
    {"gateId":"repository.release","evidenceRef":"0000000000000000000000000000000000000000000000000000000000000004","kind":"repository","provenance":"repository-control","environment":"production","market":"GH","candidateSha":"1111111111111111111111111111111111111111","issuerRef":"role/release-manager","reviewerRef":"role/engineering-reviewer","outcome":"satisfied","synthetic":true,"collectedAt":"2026-07-27T07:00:00Z","expiresAt":"2026-07-28T07:00:00Z"},
    {"gateId":"external.residency","evidenceRef":"0000000000000000000000000000000000000000000000000000000000000005","kind":"external-decision","provenance":"external-authority","environment":"production","market":"GH","candidateSha":"1111111111111111111111111111111111111111","issuerRef":"role/legal-authority","reviewerRef":"role/dpo-reviewer","outcome":"pending","synthetic":true,"collectedAt":"2026-07-27T07:00:00Z","expiresAt":"2026-08-26T07:00:00Z"},
    {"gateId":"external.production-topology","evidenceRef":"0000000000000000000000000000000000000000000000000000000000000006","kind":"external-decision","provenance":"external-authority","environment":"production","market":"GH","candidateSha":"1111111111111111111111111111111111111111","issuerRef":"role/architecture-owner","reviewerRef":"role/legal-reviewer","outcome":"pending","synthetic":true,"collectedAt":"2026-07-27T07:00:00Z","expiresAt":"2026-08-26T07:00:00Z"},
    {"gateId":"external.ghana-device-network","evidenceRef":"0000000000000000000000000000000000000000000000000000000000000007","kind":"external-decision","provenance":"external-authority","environment":"production","market":"GH","candidateSha":"1111111111111111111111111111111111111111","issuerRef":"role/qa-field-owner","reviewerRef":"role/platform-reviewer","outcome":"pending","synthetic":true,"collectedAt":"2026-07-27T07:00:00Z","expiresAt":"2026-08-26T07:00:00Z"},
    {"gateId":"provider.atlas","evidenceRef":"0000000000000000000000000000000000000000000000000000000000000008","kind":"provider","provenance":"provider-control-plane","environment":"production","market":"GH","candidateSha":"1111111111111111111111111111111111111111","issuerRef":"role/provider-custodian","reviewerRef":"role/data-reviewer","outcome":"pending","synthetic":true,"collectedAt":"2026-07-27T07:00:00Z","expiresAt":"2026-08-26T07:00:00Z"},
    {"gateId":"provider.storage-cdn","evidenceRef":"0000000000000000000000000000000000000000000000000000000000000009","kind":"provider","provenance":"provider-control-plane","environment":"production","market":"GH","candidateSha":"1111111111111111111111111111111111111111","issuerRef":"role/provider-custodian","reviewerRef":"role/security-reviewer","outcome":"pending","synthetic":true,"collectedAt":"2026-07-27T07:00:00Z","expiresAt":"2026-08-26T07:00:00Z"},
    {"gateId":"provider.live-media","evidenceRef":"000000000000000000000000000000000000000000000000000000000000000a","kind":"provider","provenance":"provider-control-plane","environment":"production","market":"GH","candidateSha":"1111111111111111111111111111111111111111","issuerRef":"role/realtime-owner","reviewerRef":"role/security-reviewer","outcome":"pending","synthetic":true,"collectedAt":"2026-07-27T07:00:00Z","expiresAt":"2026-08-26T07:00:00Z"},
    {"gateId":"provider.email","evidenceRef":"000000000000000000000000000000000000000000000000000000000000000b","kind":"provider","provenance":"provider-control-plane","environment":"production","market":"GH","candidateSha":"1111111111111111111111111111111111111111","issuerRef":"role/comms-owner","reviewerRef":"role/dpo-reviewer","outcome":"pending","synthetic":true,"collectedAt":"2026-07-27T07:00:00Z","expiresAt":"2026-08-26T07:00:00Z"},
    {"gateId":"credential.production-runtime","evidenceRef":"000000000000000000000000000000000000000000000000000000000000000c","kind":"credential","provenance":"credential-custodian","environment":"production","market":"GH","candidateSha":"1111111111111111111111111111111111111111","issuerRef":"role/credential-custodian","reviewerRef":"role/security-reviewer","outcome":"pending","synthetic":true,"collectedAt":"2026-07-27T07:00:00Z","expiresAt":"2026-07-28T07:00:00Z"},
    {"gateId":"cohort.uat","evidenceRef":"000000000000000000000000000000000000000000000000000000000000000d","kind":"cohort","provenance":"cohort-review","environment":"production","market":"GH","candidateSha":"1111111111111111111111111111111111111111","issuerRef":"role/uat-owner","reviewerRef":"role/safety-reviewer","outcome":"pending","synthetic":true,"collectedAt":"2026-07-27T07:00:00Z","expiresAt":"2026-08-03T07:00:00Z"},
    {"gateId":"cohort.launch-operations","evidenceRef":"000000000000000000000000000000000000000000000000000000000000000e","kind":"cohort","provenance":"cohort-review","environment":"production","market":"GH","candidateSha":"1111111111111111111111111111111111111111","issuerRef":"role/launch-ops-owner","reviewerRef":"role/safety-reviewer","outcome":"pending","synthetic":true,"collectedAt":"2026-07-27T07:00:00Z","expiresAt":"2026-08-03T07:00:00Z"},
    {"gateId":"store.mobile-release","evidenceRef":"000000000000000000000000000000000000000000000000000000000000000f","kind":"store","provenance":"store-console","environment":"production","market":"GH","candidateSha":"1111111111111111111111111111111111111111","issuerRef":"role/mobile-release-owner","reviewerRef":"role/security-reviewer","outcome":"pending","synthetic":true,"collectedAt":"2026-07-27T07:00:00Z","expiresAt":"2026-07-28T07:00:00Z"},
    {"gateId":"external.founder-decision","evidenceRef":"0000000000000000000000000000000000000000000000000000000000000010","kind":"external-decision","provenance":"external-authority","environment":"production","market":"GH","candidateSha":"1111111111111111111111111111111111111111","issuerRef":"role/founder-authority","reviewerRef":"role/board-reviewer","outcome":"pending","synthetic":true,"collectedAt":"2026-07-27T07:00:00Z","expiresAt":"2026-07-28T07:00:00Z"},
    {"gateId":"production.activation","evidenceRef":"0000000000000000000000000000000000000000000000000000000000000011","kind":"production-action","provenance":"change-authority","environment":"production","market":"GH","candidateSha":"1111111111111111111111111111111111111111","issuerRef":"role/release-authority","reviewerRef":"role/platform-reviewer","outcome":"blocked","synthetic":true,"collectedAt":"2026-07-27T07:00:00Z","expiresAt":"2026-07-27T11:00:00Z"}
  ]
}
